{
  "benchmark": "latent_causal_transfer_adversarial_v2",
  "budget": "quick",
  "candidates": [
    {
      "audit": {
        "ok": true,
        "path": "src/nextai_autoresearch/candidates/random_latent_independent.py",
        "problems": [],
        "sha256": "0a6ab5d6a064dfe3119701c7b2b52f2beeb940409f3cba20ec085a67b1f79704"
      },
      "candidate": "random_latent_independent",
      "error": null,
      "error_type": null,
      "execution": {
        "environment_sanitized": true,
        "log_path": "research/logs/EXP-20260830-0015-random_latent_independent.log",
        "network_policy": "forbidden_by_audit_and_rules_not_os_sandboxed",
        "peak_rss_bytes": 39239680,
        "return_code": 0,
        "termination_reason": null,
        "wall_seconds": 0.3173197000014625
      },
      "status": "complete",
      "summary": {
        "accuracy": 0.4583333333333333,
        "completed_trials": 6,
        "continual_retention": 0.6666666666666666,
        "depth_compute_slope": 0.0,
        "fit_seconds": 1.3500000932253897e-05,
        "knowledge_compute_slope": 0.0,
        "mean_query_ops": 1.0,
        "mean_warm_query_ops": 1.0,
        "p50_latency_us": 0.31666666666666665,
        "p95_latency_us": 1.5,
        "state_bytes": 2832.0,
        "status": "complete",
        "total_trials": 6,
        "update_latency_us": 0.3,
        "update_ops": 1.0,
        "warm_accuracy": 0.5416666666666666,
        "warm_op_ratio": 1.0
      },
      "traceback": null,
      "trials": [
        {
          "accuracy": 0.625,
          "continual_new_fact_accuracy": 0.625,
          "continual_retention": 1.0,
          "fit_ops": 0.0,
          "fit_seconds": 1.3500000932253897e-05,
          "gate_accuracy": 0.0,
          "knowledge_size": 8,
          "label_positive_rate": 0.5,
          "mean_local_ops": 0.0,
          "mean_perception_ops": 0.0,
          "mean_query_ops": 1.0,
          "mean_visited_nodes": 0.0,
          "mean_warm_query_ops": 1.0,
          "mean_warm_visited_nodes": 0.0,
          "ood_intervention_accuracy": 0.625,
          "p50_latency_us": 0.4,
          "p95_latency_us": 1.9,
          "query_count": 8,
          "reasoning_depth": 1,
          "seed": 1103,
          "state_bytes": 2832.0,
          "status": "complete",
          "structure_accuracy": 0.0,
          "target_mapping_accuracy": 0.0,
          "update_latency_us": 0.5,
          "update_ops": 1.0,
          "warm_accuracy": 0.375,
          "warm_p50_latency_us": 0.3,
          "warm_p95_latency_us": 0.4
        },
        {
          "accuracy": 0.375,
          "continual_new_fact_accuracy": 0.375,
          "continual_retention": 1.0,
          "fit_ops": 0.0,
          "fit_seconds": 9.999999747378752e-06,
          "gate_accuracy": 0.0,
          "knowledge_size": 8,
          "label_positive_rate": 0.5,
          "mean_local_ops": 0.0,
          "mean_perception_ops": 0.0,
          "mean_query_ops": 1.0,
          "mean_visited_nodes": 0.0,
          "mean_warm_query_ops": 1.0,
          "mean_warm_visited_nodes": 0.0,
          "ood_intervention_accuracy": 0.375,
          "p50_latency_us": 0.3,
          "p95_latency_us": 1.1,
          "query_count": 8,
          "reasoning_depth": 4,
          "seed": 1103,
          "state_bytes": 2832.0,
          "status": "complete",
          "structure_accuracy": 0.0,
          "target_mapping_accuracy": 0.0,
          "update_latency_us": 0.4,
          "update_ops": 1.0,
          "warm_accuracy": 0.625,
          "warm_p50_latency_us": 0.3,
          "warm_p95_latency_us": 0.3
        },
        {
          "accuracy": 0.375,
          "continual_new_fact_accuracy": 0.375,
          "continual_retention": 0.0,
          "fit_ops": 0.0,
          "fit_seconds": 1.0900001143454574e-05,
          "gate_accuracy": 0.0,
          "knowledge_size": 8,
          "label_positive_rate": 0.5,
          "mean_local_ops": 0.0,
          "mean_perception_ops": 0.0,
          "mean_query_ops": 1.0,
          "mean_visited_nodes": 0.0,
          "mean_warm_query_ops": 1.0,
          "mean_warm_visited_nodes": 0.0,
          "ood_intervention_accuracy": 0.375,
          "p50_latency_us": 0.3,
          "p95_latency_us": 1.1,
          "query_count": 8,
          "reasoning_depth": 6,
          "seed": 1103,
          "state_bytes": 2832.0,
          "status": "complete",
          "structure_accuracy": 0.0,
          "target_mapping_accuracy": 0.0,
          "update_latency_us": 0.2,
          "update_ops": 1.0,
          "warm_accuracy": 0.625,
          "warm_p50_latency_us": 0.3,
          "warm_p95_latency_us": 0.4
        },
        {
          "accuracy": 0.625,
          "continual_new_fact_accuracy": 0.625,
          "continual_retention": 1.0,
          "fit_ops": 0.0,
          "fit_seconds": 9.800000043469481e-06,
          "gate_accuracy": 0.0,
          "knowledge_size": 32,
          "label_positive_rate": 0.5,
          "mean_local_ops": 0.0,
          "mean_perception_ops": 0.0,
          "mean_query_ops": 1.0,
          "mean_visited_nodes": 0.0,
          "mean_warm_query_ops": 1.0,
          "mean_warm_visited_nodes": 0.0,
          "ood_intervention_accuracy": 0.625,
          "p50_latency_us": 0.3,
          "p95_latency_us": 1.1,
          "query_count": 8,
          "reasoning_depth": 1,
          "seed": 1103,
          "state_bytes": 2832.0,
          "status": "complete",
          "structure_accuracy": 0.0,
          "target_mapping_accuracy": 0.0,
          "update_latency_us": 0.2,
          "update_ops": 1.0,
          "warm_accuracy": 0.375,
          "warm_p50_latency_us": 0.2,
          "warm_p95_latency_us": 0.3
        },
        {
          "accuracy": 0.375,
          "continual_new_fact_accuracy": 0.375,
          "continual_retention": 1.0,
          "fit_ops": 0.0,
          "fit_seconds": 1.0400000974186696e-05,
          "gate_accuracy": 0.0,
          "knowledge_size": 32,
          "label_positive_rate": 0.5,
          "mean_local_ops": 0.0,
          "mean_perception_ops": 0.0,
          "mean_query_ops": 1.0,
          "mean_visited_nodes": 0.0,
          "mean_warm_query_ops": 1.0,
          "mean_warm_visited_nodes": 0.0,
          "ood_intervention_accuracy": 0.375,
          "p50_latency_us": 0.3,
          "p95_latency_us": 2.7,
          "query_count": 8,
          "reasoning_depth": 4,
          "seed": 1103,
          "state_bytes": 2832.0,
          "status": "complete",
          "structure_accuracy": 0.0,
          "target_mapping_accuracy": 0.0,
          "update_latency_us": 0.3,
          "update_ops": 1.0,
          "warm_accuracy": 0.625,
          "warm_p50_latency_us": 0.3,
          "warm_p95_latency_us": 0.3
        },
        {
          "accuracy": 0.375,
          "continual_new_fact_accuracy": 0.375,
          "continual_retention": 0.0,
          "fit_ops": 0.0,
          "fit_seconds": 1.0800000382005237e-05,
          "gate_accuracy": 0.0,
          "knowledge_size": 32,
          "label_positive_rate": 0.5,
          "mean_local_ops": 0.0,
          "mean_perception_ops": 0.0,
          "mean_query_ops": 1.0,
          "mean_visited_nodes": 0.0,
          "mean_warm_query_ops": 1.0,
          "mean_warm_visited_nodes": 0.0,
          "ood_intervention_accuracy": 0.375,
          "p50_latency_us": 0.3,
          "p95_latency_us": 1.1,
          "query_count": 8,
          "reasoning_depth": 6,
          "seed": 1103,
          "state_bytes": 2832.0,
          "status": "complete",
          "structure_accuracy": 0.0,
          "target_mapping_accuracy": 0.0,
          "update_latency_us": 0.2,
          "update_ops": 1.0,
          "warm_accuracy": 0.625,
          "warm_p50_latency_us": 0.3,
          "warm_p95_latency_us": 0.4
        }
      ]
    },
    {
      "audit": {
        "ok": true,
        "path": "src/nextai_autoresearch/candidates/latent_majority_guess.py",
        "problems": [],
        "sha256": "92faeb4f835e1dcb115fe0b66100697c3e82fba47af04f03db6a77dad7ca2d00"
      },
      "candidate": "latent_majority_guess",
      "error": null,
      "error_type": null,
      "execution": {
        "environment_sanitized": true,
        "log_path": "research/logs/EXP-20260830-0015-latent_majority_guess.log",
        "network_policy": "forbidden_by_audit_and_rules_not_os_sandboxed",
        "peak_rss_bytes": 39280640,
        "return_code": 0,
        "termination_reason": null,
        "wall_seconds": 0.3164182999989862
      },
      "status": "complete",
      "summary": {
        "accuracy": 0.5,
        "completed_trials": 6,
        "continual_retention": 0.3333333333333333,
        "depth_compute_slope": 0.0,
        "fit_seconds": 1.4299999747890979e-05,
        "knowledge_compute_slope": 0.0,
        "mean_query_ops": 1.0,
        "mean_warm_query_ops": 1.0,
        "p50_latency_us": 0.11666666666666668,
        "p95_latency_us": 0.7333333333333334,
        "state_bytes": 2832.0,
        "status": "complete",
        "total_trials": 6,
        "update_latency_us": 0.35000000000000003,
        "update_ops": 1.0,
        "warm_accuracy": 0.5,
        "warm_op_ratio": 1.0
      },
      "traceback": null,
      "trials": [
        {
          "accuracy": 0.5,
          "continual_new_fact_accuracy": 0.5,
          "continual_retention": 0.0,
          "fit_ops": 0.0,
          "fit_seconds": 1.4299999747890979e-05,
          "gate_accuracy": 0.0,
          "knowledge_size": 8,
          "label_positive_rate": 0.5,
          "mean_local_ops": 0.0,
          "mean_perception_ops": 0.0,
          "mean_query_ops": 1.0,
          "mean_visited_nodes": 0.0,
          "mean_warm_query_ops": 1.0,
          "mean_warm_visited_nodes": 0.0,
          "ood_intervention_accuracy": 0.5,
          "p50_latency_us": 0.2,
          "p95_latency_us": 0.8,
          "query_count": 8,
          "reasoning_depth": 1,
          "seed": 1103,
          "state_bytes": 2832.0,